{
  "$schema": "https://json-schema.org/draft/2020-12/schema",
  "$id": "https://github.com/beardedgingerdesigns/terraplex-spoke-hub/blob/main/spoke/spoke.schema.json",
  "title": "Terraplex Dealer Spoke Config",
  "description": "Per-dealer configuration for a Terraplex dealer site. Lives as spoke.config.json in the dealer's repo and pins against a specific hub version.",
  "type": "object",
  "additionalProperties": false,
  "required": ["hub", "dealer", "identity", "drones", "services", "story"],
  "properties": {
    "_comment": {
      "type": "string",
      "description": "Optional human-facing comment (JSON has no native comments). Used for documentation-only files like example.spoke.config.json."
    },
    "hub": {
      "type": "object",
      "description": "Identifies which hub and which hub version this spoke builds against.",
      "additionalProperties": false,
      "required": ["name", "version"],
      "properties": {
        "name": {
          "type": "string",
          "const": "terraplex",
          "description": "Must be 'terraplex'. Constrains this schema to Terraplex-hub spokes."
        },
        "version": {
          "type": "string",
          "pattern": "^\\d+\\.\\d+\\.\\d+(?:-[0-9A-Za-z.-]+)?$",
          "description": "Semver version of the hub this spoke pins to. Must match a released hub.json version."
        }
      }
    },
    "dealer": {
      "type": "object",
      "description": "Dealer business identity and contact details.",
      "additionalProperties": false,
      "required": ["id", "businessName", "ownerName", "email", "phone", "location", "serviceArea"],
      "properties": {
        "id": {
          "type": "string",
          "pattern": "^[a-z0-9]+(?:-[a-z0-9]+)*$",
          "description": "Kebab-case slug identifying the dealer. Used as the dealer folder name and as the 'dealer' key in archetypes/_index.json takenBy entries."
        },
        "businessName": {
          "type": "string",
          "description": "Legal or trading business name as displayed on the site."
        },
        "ownerName": {
          "type": "string",
          "description": "Primary owner or main point of contact."
        },
        "email": {
          "type": "string",
          "format": "email",
          "description": "Primary contact email for the dealer."
        },
        "phone": {
          "type": "string",
          "description": "Primary contact phone number as it should appear on the site."
        },
        "location": {
          "type": "object",
          "description": "Physical headquarters location of the dealer.",
          "additionalProperties": false,
          "required": ["city", "state"],
          "properties": {
            "city": { "type": "string" },
            "state": { "type": "string" }
          }
        },
        "serviceArea": {
          "description": "States or regions the dealer serves. Single string (e.g. 'nationwide', 'Iowa') or an array of state names.",
          "oneOf": [
            { "type": "string" },
            { "type": "array", "items": { "type": "string" }, "minItems": 1 }
          ]
        }
      }
    },
    "identity": {
      "type": "object",
      "description": "Visual identity choices that drive the dealer site's look and messaging.",
      "additionalProperties": false,
      "required": ["archetype", "accent", "headline", "logo"],
      "properties": {
        "archetype": {
          "type": "string",
          "enum": ["forge", "tactical", "terrain", "clean", "field", "patriot"],
          "description": "Design archetype id from archetypes/_index.json. Determines theme, hero treatment, card style, and typography approach."
        },
        "archetypeVariant": {
          "type": "string",
          "description": "Optional variant of the selected archetype. Currently only Field has variants: 'farmhouse' (default if omitted, editorial cream-dominant register) or 'industrial-farm' (loam-dominant equipment register with wheat-as-signal). Other archetypes ignore this field. Variant ids must match an entry in archetypes/_index.json under the archetype's variants array.",
          "enum": ["farmhouse", "industrial-farm"]
        },
        "accent": {
          "type": "object",
          "description": "Dealer's brand accent color system. Primary is the main brand color. Secondary is used when mode is 'gradient' or 'dual'.",
          "properties": {
            "primary": {
              "type": "string",
              "pattern": "^#[0-9a-fA-F]{6}$",
              "description": "Primary accent color as a 6-digit hex code."
            },
            "secondary": {
              "type": "string",
              "pattern": "^#[0-9a-fA-F]{6}$",
              "description": "Secondary accent color, required when mode is 'gradient' or 'dual'."
            },
            "mode": {
              "enum": ["solid", "gradient", "dual"],
              "description": "How the accent is applied. 'solid' uses primary only. 'gradient' uses primary-to-secondary gradients on CTAs and key elements. 'dual' treats primary and secondary as equal-weight brand colors."
            }
          },
          "required": ["primary", "mode"],
          "additionalProperties": false,
          "allOf": [
            {
              "if": { "properties": { "mode": { "enum": ["gradient", "dual"] } } },
              "then": { "required": ["secondary"] }
            }
          ]
        },
        "headline": {
          "type": "string",
          "description": "Hero headline unique to this dealer."
        },
        "tagline": {
          "type": "string",
          "description": "Optional subtitle shown below the headline. Most dealers have a single headline only — omit this field unless the dealer has a distinct two-line treatment."
        },
        "logo": {
          "type": "object",
          "description": "Dealer logo. Either an image (file or URL) or a text wordmark.",
          "additionalProperties": false,
          "required": ["type"],
          "properties": {
            "type": {
              "type": "string",
              "enum": ["image", "wordmark"],
              "description": "'image' uses src (file path or URL). 'wordmark' uses text."
            },
            "src": {
              "type": "string",
              "description": "Image source (required when type is 'image'). Can be a repo-relative path or an absolute URL."
            },
            "text": {
              "type": "string",
              "description": "Wordmark text (required when type is 'wordmark')."
            }
          },
          "allOf": [
            {
              "if": { "properties": { "type": { "const": "image" } } },
              "then": { "required": ["src"] }
            },
            {
              "if": { "properties": { "type": { "const": "wordmark" } } },
              "then": { "required": ["text"] }
            }
          ]
        }
      }
    },
    "drones": {
      "type": "array",
      "description": "GTEEX Revolution drone platforms carried by this dealer. Values must match product ids in products/.",
      "minItems": 1,
      "items": {
        "type": "string",
        "enum": ["r-32", "i-19"]
      },
      "uniqueItems": true
    },
    "services": {
      "type": "array",
      "description": "Services offered by the dealer. Values constrained to questionnaire.json fields.services.allowedValues.",
      "minItems": 1,
      "items": {
        "type": "string",
        "enum": [
          "Drone Sales",
          "Custom Spraying/Application",
          "Cover Crop Seeding",
          "Pest Management",
          "Service & Repair",
          "Parts",
          "Training & Certification",
          "Regulatory Support",
          "Mapping & Data",
          "Consulting"
        ]
      },
      "uniqueItems": true
    },
    "story": {
      "type": "object",
      "description": "Dealer narrative content used in About and Why-Choose sections.",
      "additionalProperties": false,
      "required": ["notableFacts"],
      "properties": {
        "founded": {
          "type": "string",
          "description": "Year the business was founded (as a string, e.g. '2019')."
        },
        "notableFacts": {
          "type": "array",
          "description": "Short factual bullets about the dealer (veteran-owned, family farm, FAA-certified, acres covered, etc.).",
          "items": { "type": "string" }
        },
        "ownerBio": {
          "type": "string",
          "description": "2-3 paragraph owner/founder biography, used in the About section."
        }
      }
    },
    "additionalEquipment": {
      "type": "array",
      "description": "Optional: additional equipment the dealer carries (trailers, skids, etc.).",
      "items": {
        "type": "string",
        "enum": ["trailers", "skids", "drone cleaners", "software", "drift control agents"]
      },
      "uniqueItems": true
    },
    "competitorDrones": {
      "type": "array",
      "description": "Optional: non-GTEEX drone brands the dealer also carries. Acknowledged but not featured prominently on the site.",
      "items": {
        "type": "string",
        "enum": ["DJI", "XAG", "EAVision"]
      },
      "uniqueItems": true
    },
    "font": {
      "type": "string",
      "description": "Optional font preference. 'system' (default) uses the Tailwind system stack. Other values should name a Google Font (e.g. 'Montserrat').",
      "default": "system"
    },
    "referenceSites": {
      "type": "array",
      "description": "URLs the dealer wants referenced for visual or structural comparison — competitors, inspiration sites, or their own existing site being replaced.",
      "items": {
        "type": "string",
        "format": "uri"
      }
    },
    "social": {
      "type": "object",
      "description": "Optional social media URLs, used in footer icon links.",
      "additionalProperties": false,
      "properties": {
        "facebook": { "type": "string", "format": "uri" },
        "instagram": { "type": "string", "format": "uri" },
        "youtube": { "type": "string", "format": "uri" },
        "tiktok": { "type": "string", "format": "uri" }
      }
    },
    "formFields": {
      "type": "object",
      "description": "Contact form configuration. Every form has the base fields (Name/Email/Phone/Message). Dealers can add extra qualifying or intent fields.",
      "properties": {
        "base": {
          "type": "boolean",
          "description": "Whether to include the standard base fields (Name/Email/Phone/Message). Should be true for all dealers."
        },
        "extraFields": {
          "type": "array",
          "description": "Additional form fields specific to this dealer's sales process. Optional.",
          "items": {
            "type": "object",
            "properties": {
              "name": { "type": "string", "description": "HTML name attribute (e.g. 'interest')." },
              "label": { "type": "string", "description": "Human-readable label shown on the form." },
              "type": {
                "enum": ["text", "number", "select", "textarea"],
                "description": "Field input type."
              },
              "options": {
                "type": "array",
                "items": { "type": "string" },
                "description": "Available options when type is 'select'. Required for select, ignored otherwise."
              },
              "required": {
                "type": "boolean",
                "description": "Whether this field is required. Defaults to false."
              }
            },
            "required": ["name", "label", "type"],
            "additionalProperties": false
          }
        }
      },
      "required": ["base"],
      "additionalProperties": false
    },
    "specialRequests": {
      "type": "array",
      "description": "Optional: dealer special requests (scheduling, reviews integration, specific page structure, etc.). Log in dealer NOTES.md as follow-ups if they can't be done in static HTML.",
      "items": { "type": "string" }
    },
    "clientQuirks": {
      "type": "array",
      "description": "Optional: non-obvious things the client insists on or has rejected before.",
      "items": { "type": "string" }
    }
  }
}
